<?xml version="1.0" encoding="UTF-8"?>
<festival id="FEST-001" version="1.0"
  xmlns:xsi="http://www.w3.org/2001/XMLSchema-instance"
  xsi:noNamespaceSchemaLocation="festival.xsd">
  <identity>
    <name>Mini festival</name>
    <edition>1</edition>
    <location>Údolní areál u řeky (fiktivní)</location>
    <startDate>2026-06-19</startDate>
    <endDate>2026-06-21</endDate>
    <description>Třidenní multižánrový festival hudby, technologií a inspirativních talků v přírodním areálu.</description>
  </identity>

  <tickets>
    <currency>CZK</currency>
    <dayPrice>590</dayPrice>
    <fullPrice>1490</fullPrice>
    <url>https://example.invalid/tickets</url>
  </tickets>

  <venues>
    <venue id="VEN-001">
      <name>Main Meadow</name>
      <type>outdoor</type>
      <capacity>1200</capacity>
      <address>
        <street>U Řeky 1</street>
        <city>Fikce</city>
        <postalCode>10000</postalCode>
        <country>CZ</country>
      </address>
    </venue>

    <venue id="VEN-002">
      <name>Workshop Barn</name>
      <type>indoor</type>
      <capacity>250</capacity>
      <address>
        <street>U Řeky 2</street>
        <city>Fikce</city>
        <postalCode>10000</postalCode>
        <country>CZ</country>
      </address>
    </venue>

    <venue id="VEN-003">
      <name>Forest Stage (Lesní scéna)</name>
      <type>outdoor</type>
      <capacity>500</capacity>
      <address>
        <street>U Řeky 1</street>
        <city>Fikce</city>
        <postalCode>10000</postalCode>
        <country>CZ</country>
      </address>
    </venue>
  </venues>

  <performers>
    <performer id="PERF-001">
      <name>Vlčí Ticho</name>
      <type>band</type>
      <genre>indie</genre>
      <country>CZ</country>
    </performer>
    <performer id="PERF-002">
      <name>River Pulse</name>
      <type>dj</type>
      <genre>electronic</genre>
      <country>CZ</country>
    </performer>
    <performer id="PERF-003">
      <name>Jana &amp; Struny</name>
      <type>band</type>
      <genre>folk</genre>
      <country>CZ</country>
    </performer>
    <performer id="PERF-004">
      <name>Noise &amp; Tea</name>
      <type>band</type>
      <genre>alt-rock</genre>
      <country>SK</country>
    </performer>
    <performer id="PERF-005">
      <name>Byte Stories</name>
      <type>speaker</type>
      <genre>talk</genre>
      <country>CZ</country>
    </performer>
    <performer id="PERF-006">
      <name>Sound Design Lab</name>
      <type>workshop</type>
      <genre>workshop</genre>
      <country>CZ</country>
    </performer>
    <performer id="PERF-007">
      <name>Sunset Strings</name>
      <type>band</type>
      <genre>acoustic</genre>
      <country>CZ</country>
    </performer>
    <performer id="PERF-008">
      <name>Midnight Crows</name>
      <type>band</type>
      <genre>rock</genre>
      <country>PL</country>
    </performer>
    <performer id="PERF-009">
      <name>Echo Forest</name>
      <type>band</type>
      <genre>indie</genre>
      <country>CZ</country>
    </performer>
    <performer id="PERF-010">
      <name>Synth Revival</name>
      <type>band</type>
      <genre>electronic</genre>
      <country>CZ</country>
    </performer>
    <performer id="PERF-011">
      <name>Akustika Studio</name>
      <type>band</type>
      <genre>acoustic</genre>
      <country>CZ</country>
    </performer>
    <performer id="PERF-012">
      <name>Heritage Voices</name>
      <type>band</type>
      <genre>folk</genre>
      <country>CZ</country>
    </performer>
    <performer id="PERF-013">
      <name>Urban Beats</name>
      <type>dj</type>
      <genre>hip-hop</genre>
      <country>CZ</country>
    </performer>
    <performer id="PERF-014">
      <name>Amara</name>
      <type>band</type>
      <genre>soul</genre>
      <country>CZ</country>
    </performer>
    <performer id="PERF-015">
      <name>Neon Lights DJ</name>
      <type>dj</type>
      <genre>electronic</genre>
      <country>DE</country>
    </performer>
    <performer id="PERF-016">
      <name>Mountain Echo</name>
      <type>band</type>
      <genre>folk</genre>
      <country>PL</country>
    </performer>
    <performer id="PERF-017">
      <name>Vortex Sound</name>
      <type>band</type>
      <genre>experimental</genre>
      <country>CZ</country>
    </performer>
    <performer id="PERF-018">
      <name>Solar Winds</name>
      <type>band</type>
      <genre>indie</genre>
      <country>SK</country>
    </performer>
    <performer id="PERF-019">
      <name>Lunar Beats</name>
      <type>dj</type>
      <genre>electronic</genre>
      <country>CZ</country>
    </performer>
    <performer id="PERF-020">
      <name>Crystal Wave</name>
      <type>band</type>
      <genre>ambient</genre>
      <country>CZ</country>
    </performer>
    <performer id="PERF-021">
      <name>Harmony Project</name>
      <type>band</type>
      <genre>world</genre>
      <country>HU</country>
    </performer>
    <performer id="PERF-022">
      <name>Nina Kráčová</name>
      <type>artist</type>
      <genre>jazz</genre>
      <country>CZ</country>
    </performer>
    <performer id="PERF-023">
      <name>Spark Collective</name>
      <type>band</type>
      <genre>indie</genre>
      <country>CZ</country>
    </performer>
    <performer id="PERF-024">
      <name>Thunder Road</name>
      <type>band</type>
      <genre>rock</genre>
      <country>CZ</country>
    </performer>
    <performer id="PERF-025">
      <name>Whisper Woods</name>
      <type>band</type>
      <genre>folk</genre>
      <country>CZ</country>
    </performer>
    <performer id="PERF-026">
      <name>TechTalk: AI &amp; Music</name>
      <type>speaker</type>
      <genre>talk</genre>
      <country>CZ</country>
    </performer>
    <performer id="PERF-027">
      <name>CreativeFlow Workshop</name>
      <type>workshop</type>
      <genre>workshop</genre>
      <country>CZ</country>
    </performer>
    <performer id="PERF-028">
      <name>Gravity Studio</name>
      <type>band</type>
      <genre>electronic</genre>
      <country>CZ</country>
    </performer>
    <performer id="PERF-029">
      <name>Nova Sound</name>
      <type>band</type>
      <genre>indie</genre>
      <country>CZ</country>
    </performer>
    <performer id="PERF-030">
      <name>Prism Colors</name>
      <type>band</type>
      <genre>pop</genre>
      <country>CZ</country>
    </performer>
    <performer id="PERF-031">
      <name>Velocity Beats DJ</name>
      <type>dj</type>
      <genre>electronic</genre>
      <country>AT</country>
    </performer>
    <performer id="PERF-032">
      <name>Serenity Sessions</name>
      <type>band</type>
      <genre>ambient</genre>
      <country>CZ</country>
    </performer>
    <performer id="PERF-033">
      <name>Radiant Strings</name>
      <type>band</type>
      <genre>classical</genre>
      <country>CZ</country>
    </performer>
    <performer id="PERF-034">
      <name>Digital Dreams</name>
      <type>band</type>
      <genre>synth-pop</genre>
      <country>CZ</country>
    </performer>
    <performer id="PERF-035">
      <name>Melody Lane</name>
      <type>band</type>
      <genre>indie</genre>
      <country>CZ</country>
    </performer>
    <performer id="PERF-036">
      <name>Legacy Sound</name>
      <type>band</type>
      <genre>rock</genre>
      <country>SK</country>
    </performer>
    <performer id="PERF-037">
      <name>Zany Zoning DJ</name>
      <type>dj</type>
      <genre>electronic</genre>
      <country>CZ</country>
    </performer>
    <performer id="PERF-038">
      <name>Horizon Line</name>
      <type>band</type>
      <genre>indie</genre>
      <country>CZ</country>
    </performer>
    <performer id="PERF-039">
      <name>Sonic Waves</name>
      <type>band</type>
      <genre>electronic</genre>
      <country>PL</country>
    </performer>
    <performer id="PERF-040">
      <name>Infinity Folk</name>
      <type>band</type>
      <genre>folk</genre>
      <country>CZ</country>
    </performer>
    <performer id="PERF-041">
      <name>Martin Svoboda</name>
      <type>speaker</type>
      <genre>talk</genre>
      <country>CZ</country>
    </performer>
    <performer id="PERF-042">
      <name>Mindful Production</name>
      <type>workshop</type>
      <genre>workshop</genre>
      <country>CZ</country>
    </performer>
    <performer id="PERF-043">
      <name>Stellar Beats</name>
      <type>band</type>
      <genre>electronic</genre>
      <country>CZ</country>
    </performer>
    <performer id="PERF-044">
      <name>Zenith Rock</name>
      <type>band</type>
      <genre>rock</genre>
      <country>CZ</country>
    </performer>
    <performer id="PERF-045">
      <name>Aurora Vocals</name>
      <type>artist</type>
      <genre>indie</genre>
      <country>CZ</country>
    </performer>
    <performer id="PERF-046">
      <name>Cosmic Journey DJ</name>
      <type>dj</type>
      <genre>electronic</genre>
      <country>CZ</country>
    </performer>
    <performer id="PERF-047">
      <name>Sacred Notes</name>
      <type>band</type>
      <genre>world</genre>
      <country>CZ</country>
    </performer>
    <performer id="PERF-048">
      <name>Phoenix Rise</name>
      <type>band</type>
      <genre>indie</genre>
      <country>CZ</country>
    </performer>
    <performer id="PERF-049">
      <name>Quantum Sound</name>
      <type>band</type>
      <genre>experimental</genre>
      <country>CZ</country>
    </performer>
    <performer id="PERF-050">
      <name>Elena Šulc</name>
      <type>artist</type>
      <genre>folk</genre>
      <country>CZ</country>
    </performer>
    <performer id="PERF-051">
      <name>Urban Forest</name>
      <type>band</type>
      <genre>indie</genre>
      <country>CZ</country>
    </performer>
    <performer id="PERF-052">
      <name>Digital Echo</name>
      <type>band</type>
      <genre>electronic</genre>
      <country>CZ</country>
    </performer>